{
  "$schema": "../schema/theme.schema.json",
  "name": "Ocean Breeze",
  "description": "Cool blue and teal dark theme inspired by deep ocean depths",
  "author": "community",
  "version": "1.0.0",
  "isDark": true,
  "preview": ["#0a1628", "#e2e8f0", "#38bdf8"],
  "variables": {
    "background": "#0a1628",
    "foreground": "#e2e8f0",
    "card": "#0f2035",
    "cardForeground": "#e2e8f0",
    "primary": "#38bdf8",
    "primaryForeground": "#0a1628",
    "secondary": "#164e63",
    "secondaryForeground": "#e2e8f0",
    "muted": "#1e3a5f",
    "mutedForeground": "#94a3b8",
    "accent": "#0891b2",
    "accentForeground": "#e2e8f0",
    "destructive": "#ef4444",
    "destructiveForeground": "#fef2f2",
    "border": "#1e3a5f",
    "input": "#1e3a5f",
    "ring": "#38bdf8"
  }
}
